user,search query,post date-time,account status,account sentiment,account sentiment score,retweet status,retweet sentiment,retweet sentiment score,post location,tweet id,account subjectivity,account subjectivity score,retweet subjectivity,retweet subjectivity score
mashable,self driving future,2019-05-29 22:27:00,The future of self-driving taxis may be closer than you think https://t.co/USR1b228pL https://t.co/f3uO4UhVb4,neutral,0.0,,,,,1133862329798410240,very objective,0.125,,
MicheleTrainer,self driving future,2019-05-29 21:40:41,#MediumMastery “Facing the Fears of our Autonomous Self-Driving Vehicle Future” by MicheletheTrainer https://t.co/DyTuGGIjgR,positive,0.2,,,,,1133850675891228672,objective,0.4125,,
joelvitrano,self driving future,2019-05-30 23:35:51,Self driving cars = adults napping on their way home from work. I’m ready for the future,positive,0.1,,,,,1134242045890052099,objective,0.3125,,
rcgeconomics,self driving future,2019-05-30 23:12:25,"""Self-driving vehicle technology may be coming, but most city leaders aren’t doing much to anticipate our robot-car future, a new study warns.""

 Luckily for us, @RTCSNV is thinking ahead. 

https://t.co/IzdHYCMhVI",positive,0.23393939393939395,,,,,1134236147780063232,objective,0.42257575757575755,,
JeroenBartelse,self driving future,2019-05-30 23:07:21,"L.A. Is Planning for the Self-Driving Future. Most Cities Aren't. https://t.co/otqwPoqVEm
via @CityLab 
#city #SelfDrivingCars #Driverless #Autonomous #planning #selfdriving #LA https://t.co/4vBtMsInFZ",positive,0.3,,,,,1134234874146168832,objective,0.44166666666666665,,
hup333,self driving future,2019-05-30 22:59:38,@CNET In the future will all be using self driving cars,neutral,0.0,,,,,1134232931239682051,very objective,0.125,,
FBJlaw,self driving future,2019-05-30 22:10:06,"As technology propels us toward self driving cars, let's take a look at what the future of Autonomous Vehicles has in store for us.

https://t.co/ZEvSX3oMTW",positive,0.2,,,,,1134220464191148034,objective,0.4125,,
waveridderr,self driving future,2019-05-31 23:43:18,This issue presents a problem in public discourse. Is his life worth less because he is homeless so he shouldn’t deserve to get a transplant over someone who may have a successful future? I’ve seen the same thing with self-driving cars https://t.co/12DRWDLs92,positive,0.14722222222222223,What kind of a sick fucking dystopia do we live in where a sick homeless child will be denied a life-saving kidney transplant solely because he is homeless? https://t.co/PBfQ5lP6cV,negative,-0.2584415584415584,,1134606309716844548,very objective,0.2388888888888889,very subjective,0.7828571428571428
bergdaballer,self driving future,2019-05-31 22:52:44,@marcdemesel You are right Marc self driving cars are the future. The problem I see is that the technology moves a lot faster the the legislation. Many companies will catch up with Tesla while we wait for laws to pass therefore diminishing Tesla's advantage.,positive,0.2619047619047619,,,,,1134593583611121664,objective,0.38690476190476186,,
performancefor2,self driving future,2019-05-31 22:30:26,"Digit: Future of Self-Driving Vehicle Delivery | The Future of Ford and Transportation | Ford #ford #digit #future #selfdriving #selfdrivingvehicle #futureofford #youtube 
https://t.co/3Pim0T1CfT",neutral,0.0,,,,,1134587969162141698,very objective,0.125,,
PerformanceLF,self driving future,2019-05-31 22:30:26,"Digit: Future of Self-Driving Vehicle Delivery | The Future of Ford and Transportation | Ford #ford #digit #future #selfdriving #selfdrivingvehicle #futureofford #youtube 
https://t.co/nD2z1z1JHo",neutral,0.0,,,,,1134587968918892549,very objective,0.125,,
CyrusMacD,self driving future,2019-05-31 21:40:34,@jonathon_klein @ebcapital @Tesla @Tesla has to deal with regulators all the time. Cars are heavily regulated and they will need to go through regulators for full self driving. Tesla wouldn't bet their self-driving future on lies about safety. Sleep on it. I'll do the same. This isn't trivial.,positive,0.03749999999999999,,,,,1134575420182061056,objective,0.325,,
hbaskas,self driving future,2019-06-01 22:59:27,#Airport amenities of the future? Self-driving wheelchairs + collision-averting #suitcases. #StuckatTheAirport https://t.co/jHNVuvNknd https://t.co/YJ2TVlNOq2,neutral,0.0,,,,,1134957661546602499,very objective,0.125,,
MATHandHumanity,self driving future,2019-06-01 22:53:34,"@daveweigel Yes!! give uber drivers employee rights.
but what heppens when automation reduces the need for Uber drivers?

Uber will no doubt try to roll out self-driving cars in the future

#HumanityFirst",neutral,0.0,,,,,1134956179845607424,very objective,0.125,,
EthosLifestyle,self driving future,2019-06-01 21:54:04,"Surviving #ClimateChange: What Would A Low Carbon Future Look Like?

Space-based solar, lab-grown meat, and self-driving electric cars: envisioning a low-carbon society of the future

https://t.co/8mvaFvXK9J @tabithawhiting #climatebreakdown #CO2 #ethoslifestyle",neutral,0.0,,,,,1134941207472365568,very objective,0.18333333333333335,,
lisaestrin,self driving future,2019-06-01 21:48:51,Daniel Tiger’s Neighborhood has self-driving trolleys and kindness... hoping it’s foreshadowing our future...,neutral,0.0,,,,,1134939894223183872,very objective,0.125,,
AhabValue,self driving future,2019-06-01 19:55:43,"@RandyVegetables Respectfully, not believing in FSD and not believing in future growth are reasonable base case assumptions based on available data, such as the Navigant survey that puts Tesla behind Google, GM, Ford, VW and others in Self Driving and also the large QoQ delivery declines.",negative,-0.07946428571428572,,,,,1134911423027355648,subjective,0.5566964285714285,,
Joliviarode44,self driving future,2019-06-02 22:06:36,@LeoDiCaprio  I know this is presumptuous but I have written a script about the environment and the possible extinction of animal life. It is a comedy but has a serious message. The title is MA AND PA AND THE SELF DRIVING CAR: the near future. I would love you to look at it. THX,positive,0.053333333333333344,,,,,1135306748846170114,subjective,0.5583333333333333,,
WSWMUC,self driving future,2019-06-02 21:04:01,"Why aren’t Cities getting ready for #Autonomous Vehicles?

🚖 Self-driving vehicle technology may be coming, but most city leaders aren’t doing much to anticipate our robot-car future, a new study warns

#smartcity #digitaltransformation 
https://t.co/7ztUUHEDkd https://t.co/I36erIQAEn",positive,0.2393939393939394,,,,,1135290999083851776,objective,0.41325757575757577,,
CapgeminiAIE,self driving future,2019-06-02 20:50:04,Inform. Reassure. Build. Develop. This is the mantra for automotive companies to acccelerate the journey towards a self-driving future. Download our latest report on #autonomouscars for more insights: https://t.co/RUqJP5K0G2 https://t.co/ztuCqo39VY,positive,0.3333333333333333,,,,,1135287487302111239,subjective,0.5083333333333333,,
PhantasmaPlumes,self driving future,2019-06-02 19:05:18,"Tesla: Designs the first self-driving car to create safer roads, give people more time to relax, and help pave the future for innovation

Also Tesla: Puts a game in guaranteed to continue road rage. Just at a cartoon cup and not the Suburban that can't drive in front of you. https://t.co/tkRyoACxyx",positive,0.06999999999999999,"Cuphead is coming soon to... Tesla cars. Yep, you read that right: https://t.co/4zueZBuLRv https://t.co/PNVBnaiePl",positive,0.2857142857142857,,1135261123257802754,objective,0.27166666666666667,subjective,0.5357142857142857
robypugliese,self driving future,2019-06-02 17:12:33,"Lyft has completed 55,000 self-driving rides in Las Vegas with a fleet of 30 fully autonomous self driving cars. Future is now! 
https://t.co/J1yLppHQO9 via @engadget",positive,0.2,,,,,1135232746790563840,objective,0.4125,,
gms4sbc,self driving future,2019-06-03 23:10:05,"Autonomous 'Wingman' Vehicles: The Future of Military Unmanned Vehicle Technology. The @DeptofDefense believes it will be the first to actually deploy self-driving vehicles. @gms4sbc's Chris Ciufo for Aerospace &amp; Defense Technology. #RCV #futurebattlefield
https://t.co/27GFBl4yi5 https://t.co/8KX3ACHteg",positive,0.11000000000000001,,,,,1135685113583427591,objective,0.27166666666666667,,
wetaber,self driving future,2019-06-03 22:10:25,"Fiat Chrysler confirmed that it is seeking a merger with France's Renault, a combination that would create the world's third largest car company behind Volkswagen and Toyota - to bolster future investments in electric vehicles and self-driving cars- The Economist",neutral,0.0,,,,,1135670097677291523,objective,0.45625,,
MWarreyn,self driving future,2019-06-03 22:03:09,"@Edward73641124 @elonmusk @Tesla @teslaownersSV 😂😂😂 You expect that the company that sells ""full self driving"" as an up-to-$7k-option that will be available in the future should tell you? Come on, you cant be so naive.",positive,0.1125,,,,,1135668268348428288,subjective,0.51875,,
NewWorldAI1,self driving future,2019-06-03 21:45:34,The future of artificial intelligence and self-driving cars https://t.co/6sNyC01Ulc,negative,-0.3,,,,,1135663841969344517,subjective,0.5625,,
TowerEdTech,self driving future,2019-06-03 21:30:32,"Google develops the self-driving car in their top-secret X lab in 2009. Would you let go of the wheel in the future?
#technology #education #future #cloud #tech #solutions #highereducation #highered #learning #college #students #educationsystem #cellegeeducation #global #edtech https://t.co/ewOMFtp89c",neutral,0.0,,,,,1135660057922887680,very objective,0.08333333333333333,,
soloalam1,self driving future,2019-06-04 22:35:18,"Billions work for Uber millions use Uber who were is that the new future and transportation and investment in vehicle self driving cars...UBER LOVE

https://t.co/UbObfipk9a",positive,0.21212121212121213,,,,,1136038745461760002,objective,0.39318181818181824,,
kevaldesai,self driving future,2019-06-04 22:08:56,Thankfully he is OK = I bet $10 he shows up in a self-driving car commercial sometime in the future = https://t.co/7NBWzoa9ds,positive,0.16666666666666666,Tracy Morgan Involved in Car Accident While Driving $2M Bugatti 5 Years After Near-Fatal Crash https://t.co/PYUXczhsXA,neutral,0.0,,1136032112060932097,very objective,0.20833333333333334,very objective,0.0
BlackcirclesCa,self driving future,2019-06-04 20:40:29,The future of goods transportation with the Einride Self-driving truck #selfdriving #einride #selfdrivingtruck #transportinnovation #blackcirclescanada à Movin'On https://t.co/Z2kIa1gTVd,neutral,0.0,,,,,1136009852503957504,very objective,0.125,,
_beckyhoward,self driving future,2019-06-04 20:19:07,"I love all of the background ‘this is what the near future looks like’ stuff in #YearsAndYears like the cardboard plates and self-driving cars, but my absolute favourite has to be Dermot O’Leary as a political reporter https://t.co/hlZaR1Flh1",positive,0.16,,,,,1136004475985039361,objective,0.425,,
scruffy_dug,self driving future,2019-06-04 18:51:00,"So, he's saying is that jobs will change in the future? I'd better break that to all of the Taxi and Truck driver who'll be made redundant by self driving vehicles, and all of the other  jobs which have faded out of existence in the past. What a genius.

https://t.co/7mnFyzOr5I",negative,-0.015000000000000003,,,,,1135982300464898049,objective,0.29,,
Fatblokeonabike,self driving future,2019-06-05 22:53:51,"5) the future belongs to electric, self driving vehicles. Gas vehicles will be museum pieces.",neutral,0.0,,,,"Place(_api=<tweepy.api.API object at 0x134623b38>, id='6a6d896ba1cb5dc4', url='https://api.twitter.com/1.1/geo/id/6a6d896ba1cb5dc4.json', place_type='city', name='Edmonton', full_name='Edmonton, Alberta', country_code='CA', country='Canada', contained_within=[], bounding_box=BoundingBox(_api=<tweepy.api.API object at 0x134623b38>, type='Polygon', coordinates=[[[-113.71368, 53.395531], [-113.271555, 53.395531], [-113.271555, 53.7161084], [-113.71368, 53.7161084]]]), attributes={})",1136405804033032194,very objective,0.125,,
thostalk,self driving future,2019-06-05 22:00:38,"@imnottayediggs They repaid him by chemically castrating him and driving him to suicide.  Frankly that’s so disgusting the allies didn’t deserve his help

If his younger self somehow saw that future, and withheld his critical war work as a result, I wouldn’t fault him",negative,-0.25,,,,,1136392412237053953,objective,0.48125,,
SelfDrivingFEED,self driving future,2019-06-05 21:37:24,USPS Hails Self-Driving Technologies for Future Mail Delivery | https://t.co/kYoj1lVvKl https://t.co/G67dzY53kK #autonomousCar #selfDrivingCar,neutral,0.0,,,,,1136386565612232705,very objective,0.125,,
wesleydashner,self driving future,2019-06-05 19:55:06,Electric and self-driving is the future. Tesla already has both.,neutral,0.0,,,,,1136360818205908993,very objective,0.125,,
GSCTXcouncil,self driving future,2019-06-05 19:35:07,"Take a blast into the future at our Cyberdender Day at Cisco on Aug. 7! 

Spend the day programming self-driving cars and see if you can find your way out of the virtual escape room. Register today: https://t.co/Gh400iMeuF https://t.co/Te08dBJFHI",neutral,0.0,,,,,1136355789927571456,very objective,0.125,,
blackllama,self driving future,2019-06-06 23:42:25,"Holy moly, we were just in a self driving car! 😍 Thanks for the taste of the future @Aptiv! https://t.co/4tUfRoQC7x",positive,0.1,,,,,1136780414935113729,very objective,0.1625,,
ipo_monster,self driving future,2019-06-06 23:34:48,"The car that I bought is self-driving.

Self-driving is a future technology.",neutral,0.0,,,,,1136778497689448448,very objective,0.125,,
ipo_monster,self driving future,2019-06-06 23:34:02,"There is currently a shortage of jobs.

I want to do many things but there is a shortage in time.

The car that I bought is self-driving.

Self-driving is a future technology.

I need to transport my goods to America.

#morningenglish

https://t.co/qcY7qKEVrI",positive,0.16666666666666666,,,,,1136778305082806272,objective,0.3416666666666666,,
UBI4UandI,self driving future,2019-06-06 22:43:53,"@ClaireBerlinski It’s not if, but when the solutions he’s proposing will be necessary. It might take a couple months, but you do start feeling positive about the future. And it adds a whole new level of this-makes-sense to enjoy all over again. Eg. I’m now really excited for self driving cars. 😀",positive,0.19123376623376623,,,,,1136765682224250880,subjective,0.5392857142857143,,
autonewssiite,self driving future,2019-06-06 21:02:50,"Boxbot Shows Off Autonomous Electric Deliver Vehicle - Future autonomous vehicles may spend more time carrying packages than people. Several companies, from large automakers to small startups, are experimenting with self-driving delivery vehicles. The latest is Boxbot, which w... https://t.co/zujO2Sy1Ft",positive,0.22053571428571428,,,,,1136740254717812737,objective,0.4691964285714285,,
ReubenJones1,self driving future,2019-06-07 20:20:43,What's the future of self-driving vehicles in NC? These autonomous vehicles will be hitting some streets before the end of the year. But there's a catch. I'll explain Saturday at 5 and 6 on @SpecNewsCLT. @NCDOT https://t.co/VRk9wSdBz8,positive,0.2,,,,,1137092043065503745,objective,0.4125,,
islamarissa,self driving future,2019-06-07 18:55:48,The @lyft self-driving option was so cool and insightful to what’s to come in the future!! 🚗,positive,0.175,,,,,1137070673501626368,objective,0.3875,,
UBI4UandI,self driving future,2019-06-07 17:25:05,"@MurrayRothbar11 @Yang4M @Emsatthedisco I used to be confused why we needed self driving cars - now I’m wondering why cities are spending vast money amounts on costly transit projects that won’t be ready for 20 years or so. A tweet is not enough to give all my reasons, but our the future is going to be really different",negative,-0.03333333333333333,,,,,1137047841145143297,subjective,0.5708333333333334,,
CACPGT_wRERC,self driving future,2019-06-07 16:16:28,"Self-driving vehicle technology may be coming, but most #CityLeaders aren’t doing much to anticipate our robot-car future, a new study warns. https://t.co/uCcl0pBPug #SelfDrivingVehicles #AutonomousVehicles #UrbanPlanning",positive,0.20909090909090908,,,,,1137030575120928769,objective,0.31988636363636364,,
gayatri397,self driving future,2019-06-07 15:24:37,Inform. Reassure. Build. Develop. This is the mantra for automotive companies to accelerate the journey towards a self-driving future. Download our latest report on #autonomouscars for more insights: https://t.co/337xtKMRun,positive,0.3333333333333333,,,,,1137017524657315840,subjective,0.5083333333333333,,
hijabiseok,self driving future,2019-06-08 23:21:02,imagine in the future if self driving cars can  purposefully goto billboards or shops sort of like how you get adverts in yotube but like in real life and you'd have to pay a subscription fee to get a smarter car that doesnt give you ads,positive,0.1,,,,,1137499806023241728,very objective,0.21250000000000002,,
StanSundel,self driving future,2019-06-08 19:07:41,"""To Walmart executives, the Auto-C self-driving floor scrubber is the future of retail automation...But to the workers of Walmart...the machine has a different label: 'Freddy,' named for a janitor the store let go shortly before the Auto-C rolled to life."" https://t.co/MXGIa0bFiM",neutral,0.0,,,,,1137436051155427328,objective,0.3416666666666666,,
truthtableJCT,self driving future,2019-06-08 18:57:04,"Would you feel nervous passing a self-driving truck? See ""Turing's Nightmares"" on Amazon for a host of scenarios of the #future of #AI &amp; #Robotics - https://t.co/1W4I6j2e1W https://t.co/xkobxqfMJt",neutral,0.0,,,,,1137433379169640448,very objective,0.125,,
MerchOpera,self driving future,2019-06-08 14:48:46,@Gravittation @NachT666 @FilmJunkie82 @Variety @elonmusk Fuck a cleaner atmosphere and a safe self driving future when you can sip on that Haterade 😂 https://t.co/KhbuObcnvz,positive,0.033333333333333326,,,,,1137370890365296641,objective,0.4083333333333334,,
thesmithstorian,self driving future,2019-06-08 13:30:59,"On the drive back to Stuttgart yesterday the heater in the Ford kept turning on by itself. This is why self driving cars are not the future. Furthermore, I can drive myself, thank you very much.",positive,0.08666666666666667,,,,,1137351317465325570,very objective,0.12833333333333333,,
SaleemUsama,self driving future,2019-06-09 23:18:15,"(2/3) As Tesla flourishes in the future, automakers will be crippled without self driving tech as well as without self driving data. Today, Tesla already has 1B miles of such data, while others have 0.",neutral,0.0,,,,,1137861495142981633,objective,0.3125,,
wdfloyd,self driving future,2019-06-09 22:25:49,"Your Future Self-Driving Car Will Be Watching Your Every Move, Says New Study - Interesting Engineering https://t.co/ms7jmrUqCL",positive,0.21212121212121213,,,,,1137848299497623552,objective,0.35984848484848486,,
Samanth68649752,self driving future,2019-06-09 22:25:12,The Self-Driving Cleveron’s Robot Courier Of The Future Prototype https://t.co/LOMSoICY1D,neutral,0.0,,,,,1137848142488100865,very objective,0.125,,
NEWSFORT1,self driving future,2019-06-09 22:14:21,The Self-Driving Cleveron’s Robot Courier Of The Future Prototype https://t.co/aXiL5Kmtxt,neutral,0.0,,,,,1137845413296431106,very objective,0.125,,
rory_christie,self driving future,2019-06-09 21:58:51,The future is not self driving cars https://t.co/4uZWNOHaC7,neutral,0.0,"Our love affair with the car has no future. For the UK's 31 million cars to become electric we'd need huge and unsustainable amounts of cobalt, lithium &amp; copper. 

Massive boost for public transport &amp; active travel plus shared cars the only way forward. 
https://t.co/gAsAlQrYhB",positive,0.10952380952380955,,1137841513365475329,very objective,0.125,subjective,0.6130952380952381
JPUConn,self driving future,2019-06-10 23:40:22,@ValueAnalyst1 A fallacy that self driving cars should be goofy and “future” looking.,positive,0.25,,,,,1138229448564707328,subjective,0.5625,,
TOURMISS,self driving future,2019-06-10 23:03:26,Self driving only possible yes future!! https://t.co/E1SqLKrdNe,neutral,0.0,"Self-driving spacecraft are coming

Learn how human travel in space may one day rely on @NASA’s Deep Space Atomic Clock: https://t.co/ipv3uVgPo8 https://t.co/PajUi35Grr",neutral,0.0,,1138220154985357312,subjective,0.7083333333333334,very objective,0.25
CPR_CS_Inc,self driving future,2019-06-10 23:00:18,"Listen to C-Store Technology Oracle podcast, Biometrics and C-Stores of the Future.  Improving customer experience through biometrics, Palm Payments, Retina Scanners, Self Driving Delivery Vehicles and more.  #cstore https://t.co/hBK0oT3lYO",positive,0.25,,,,,1138219367160864773,objective,0.3125,,
gerren,self driving future,2019-06-10 22:42:15,"Between Uber's self driving trucks, Boston Dynamics warehouse robots, and https://t.co/MezRkwo5yY drone delivery

We really need to start talking about what Humans are going to do for work in the VERY near future.",positive,0.11,,,,,1138214822326284294,objective,0.2816666666666667,,
theoverheadwire,self driving future,2019-06-10 19:42:58,"Accelerometers in phones for testing bridge vibrations? Self driving boats in Amsterdam canals? Carlo Ratti, Director of MIT's @SenseableCity Lab has some ideas for the future of data &amp; cities. #HerePartners https://t.co/in2VnrV1cs",neutral,0.0,How would you use data to improve your city?,neutral,0.0,,1138169705540259840,very objective,0.125,very objective,0.0
Autotestdrivers,self driving future,2019-06-11 23:46:09,"Tesla looks to launch human-driven Uber/Lyft competitor before robotaxi rollout: One of Tesla’s future plans is to roll out a network of self-driving “robotaxis,” dubbed “Tesla Network.”  In today’s Tesla shareholder meeting, CEO… https://t.co/6XX2xpJAbf #Cars #Autos #Automotive https://t.co/wDtcYZhSX0",neutral,0.0,,,,,1138593291899768832,very objective,0.125,,
SelfDrivingFEED,self driving future,2019-06-11 22:37:26,Morgan Stanley says investors are undervaluing Tesla%27s self-driving future https://t.co/7Nv1j9zdYy #autonomousCar #selfDrivingCar,neutral,0.0,,,,,1138575998562312192,very objective,0.125,,
RaulSeema,self driving future,2019-06-11 22:30:47,"@Teslarati @elonmusk Truck ""Kitt"" self driving is supper hot! This is more future than Robotaxi!🎯👍",positive,0.2708333333333333,,,,,1138574325081157633,objective,0.4916666666666667,,
Godinger29,self driving future,2019-06-11 20:58:56,Morgan Stanley: Investors 'undervalue' the future of Tesla's self-driving tech @CNBC  https://t.co/lgJAZZCPvi,neutral,0.0,,,,,1138551209235795973,very objective,0.125,,
lorakolodny,self driving future,2019-06-11 20:46:59,In a note today from Morgan Stanley on Tesla -- Adam Jonas says investors are undervaluing Tesla's self-driving future https://t.co/teLl2hfFc0 by @thesheetztweetz via @cnbctech,neutral,0.0,,,,,1138548203513556992,very objective,0.125,,
WDTNN2,self driving future,2019-06-12 23:00:20,Howes: Self-driving cars are 'not a science-fiction story' - The Detroit News - Howes: Self-driving cars are 'not a science-fiction story' The Detroit NewsTech-heavy auto industry of the not-too-distant future will require fewer parts and more people... https://t.co/y7s6w70qcZ https://t.co/kmopreqMQ5,positive,0.25,,,,,1138944149149945857,objective,0.3125,,
QS2Point,self driving future,2019-06-12 22:44:01,"A green future of transportation: how self-driving cars will be make or break
https://t.co/OwjDxKK38p

#ElectricVehicles #ElectricVehicle #Cars #Features #future #technology #beengreen #sustainability #mobility https://t.co/SY9ZLEmF1Q",negative,-0.06666666666666667,,,,,1138940042850836480,very objective,0.18333333333333335,,
AlexKar23788310,self driving future,2019-06-12 21:46:32,Authored my first article for @therobotreport. Researchers have significantly improved camera-based object detection for self-driving vehicles. Read how they achieved this and how it could impact the future of autonomous vehicles https://t.co/vVUnCAMxhF,positive,0.25625,,,,,1138925576369184768,subjective,0.5083333333333333,,
news4buffalo,self driving future,2019-06-12 20:15:35,"Uber is betting its self-driving future on their new autonomous vehicle, which it plans to test on the streets later this year. The updates come after a self-driving Uber hit and killed a woman crossing a street in Arizona in March 2018 (CBS/VIDEO) https://t.co/ExMObeDyPA",positive,0.06727272727272728,,,,,1138902688333205504,objective,0.2559090909090909,,
Volvo_Natick,self driving future,2019-06-12 17:55:04,Back to the future: Volvo and Uber's first self-driving car is ready for the road. See More:https://t.co/jbmF1TYq1v https://t.co/2UOHgziV7f,positive,0.19,,,,,1138867326756032519,objective,0.29166666666666663,,
Indy_Austin,self driving future,2019-06-13 23:01:10,@robdaemon the self-driving future is increasingly dumb,negative,-0.1875,,,,,1139306746227429377,objective,0.3125,,
sriramhebbar,self driving future,2019-06-13 22:56:35,Volvo Cars And Uber Reveal Production Ready Self Driving Car — The Future Of Lazy Is Here https://t.co/6rPyTi6bUM https://t.co/m1jorNyTZL,negative,-0.016666666666666663,,,,,1139305593330524161,subjective,0.5416666666666666,,
levie,self driving future,2019-06-13 22:11:56,That awkward moment when you just bought a self-driving car thinking it was the future of transportation and then personal jet packs come out. https://t.co/CXJD5xMcwr,negative,-0.19999999999999998,Rocket man from Gravity at #CodeCon #loud https://t.co/3rxOWaC9z4,positive,0.1,,1139294355800252418,objective,0.47500000000000003,very subjective,0.8
