user,search query,post date-time,account status,account sentiment,account sentiment score,retweet status,retweet sentiment,retweet sentiment score,post location,tweet id,account subjectivity,account subjectivity score,retweet subjectivity,retweet subjectivity score
autoinfo_aniket,human machine interface vehicles,2020-01-08 12:29:17,Unity Technologies announced collaboration with NXP Semiconductors to develop a human machine interface (HMI) toolchain that creates modern vehicle experiences in mass production vehicles. #NXP,positive,0.1,,,,,1214886793180434434,very objective,0.2,,
enweyant,human machine interface vehicles,2020-01-21 06:42:26,Human-Machine Interface for Autonomous Vehicles #UI #UserInterface #HMI via https://t.co/Al8HXkk4hR https://t.co/Y8JTOgrtCP,positive,0.4,,,,,1219510546376032257,subjective,0.7,,
Digiosaajat,human machine interface vehicles,2020-02-03 09:24:34,Human-Machine Interface for Autonomous Vehicles https://t.co/pNmimvdgUg #UserInterface #HMI #UI https://t.co/JJGza7tf92,positive,0.4,,,,,1224262390981779456,subjective,0.7,,
GrowthTechNews,human machine interface vehicles,2020-02-03 07:21:33,Human-Machine Interface for Autonomous Vehicles https://t.co/U60yL1Y956 #UI #HMI #UserInterface https://t.co/l67k4YmA5d,positive,0.4,,,,,1224231431335022592,subjective,0.7,,
Digiosaajat,human machine interface vehicles,2020-03-23 09:26:38,Human-Machine Interface for Autonomous Vehicles https://t.co/pNmimvdgUg #HMI #UserInterface #UI https://t.co/TlMj5EGbFb,positive,0.4,,,,,1242019918008254464,subjective,0.7,,
GrowthTechNews,human machine interface vehicles,2020-03-23 07:34:16,Human-Machine Interface for Autonomous Vehicles https://t.co/U60yL1Y956 #UserInterface #HMI #UI https://t.co/KWkyvk5ZQ6,positive,0.4,,,,,1241991639624712198,subjective,0.7,,
sachinxr,human machine interface vehicles,2020-05-18 17:38:43,"Autonomous vehicles, connectivity, electrification, shared mobility, AI, big data &amp; analytics, human-machine interface, blockchain, additive manufacturing, and IoT are the top 10 automotive industry trends in 2020 and beyond.

https://t.co/JDb3Hhu5U4 https://t.co/Hn5Oty0NIv",positive,0.3,,,,,1262437475596685312,objective,0.4333333333333333,,
nathanamarsh,human machine interface vehicles,2020-05-20 10:29:29,"Signs of #UKrecovery as our CAM teams practice social distancing at MFM testbed, while providing our smart infrastructure solutions of digital CCTV, Human Machine Interface (HMI) for vehicles and video analytics. https://t.co/RYkjAjDECg",positive,0.0619047619047619,,,,,1263054227917680641,very objective,0.20238095238095238,,
AbinavRavi,autonomous vehicles research,2020-01-01 18:15:20,@TVMohandasPai @YouTube I do research in the field. most of it is just PR. Truth is systems are not so sophisticated we are far away from complete autonomous vehicles or a thinking robot. Currently the most advanced robo problem is solving Rubik's cube. But potential is high and India can benefit a lot,positive,0.266,,,,,1212437163532521473,subjective,0.6639999999999999,,
GiovannaGenard,autonomous vehicles research,2020-01-05 14:52:33,"Tapping into higher ed innovation &amp; research—bioelectrics, offshore wind energy, maritime and port, nuclear physics, aquaculture, SmallSats, autonomous vehicles and more—can transform the #757 economy ⁦@ODU⁩ ⁦@JLab_News⁩ ⁦⁦@Growth4VA⁩  https://t.co/IRKsIynQDQ",positive,0.325,,,,,1213835683950931968,subjective,0.6,,
translationwork,autonomous vehicles research,2020-01-05 04:25:13,Research Paper on Autonomous Vehicles(CAV) - https://t.co/joTTnfLkBA,positive,0.4,,,,,1213677809505374208,subjective,0.7,,
TrumpWatcher8,autonomous vehicles research,2020-01-06 03:11:24,@WillWithers30 @cnnbrk @elonmusk All manufacturers are working on autonomous vehicles it’s going to revolutionize the economy. Do your research.,positive,0.4,,,,,1214021620676870146,subjective,0.7,,
SJSU,autonomous vehicles research,2020-01-07 18:43:24,"Autonomous vehicles are the future. Are they safe? Assistant Professor of Aviation Francesca Favaro and her research team are assessing the risks and rewards of the next generation of transportation. https://t.co/2Nx5aqXFk7

@LucasCollege @SJSUEngineering @MinetaTrans https://t.co/iqtXb489C0",positive,0.225,,,,,1214618552709238784,objective,0.33125,,
NASAaero,autonomous vehicles research,2020-01-07 17:45:01,"Quiet supersonic flight. Electric aircraft. Autonomous vehicles. If you're attending #aiaaSciTech, visit the NASA exhibit to experience how our research benefits the public and supports our nation’s position as a leader in aerospace technologies and transformative systems. https://t.co/MpS0GvBmEG",positive,0.13333333333333333,,,,,1214603863233351680,objective,0.36666666666666664,,
MKutney,autonomous vehicles research,2020-01-07 13:28:39,"🚀 New research coming out of @bruyerecare 🚀: ""Semi-Autonomous Vehicles as a Cognitive Assistive Device for Older Adults"" - https://t.co/qqVzSYdgWV - cc: @QNX_News @FedDevOntario @LSPARKGlobal #BeMoved",positive,0.1515151515151515,,,,,1214539343680933888,objective,0.3939393939393939,,
SOLIDWORKS,autonomous vehicles research,2020-01-07 01:00:01,The University of Michigan is conducting research to improve the safety of #autonomous vehicles by using Augmented Reality-based #simulation. #AR  https://t.co/pZJfnlkV1m https://t.co/sZwpYLMtmi,positive,0.4,,,,,1214350944500166657,subjective,0.7,,
spooney35,autonomous vehicles research,2020-01-08 23:31:19,@momness1 it's the newest technology from around the world. Lots of amazing stuff dealing with autonomous vehicles research health communications smarthomes security you name it they got it. Databases are using facial recognition to give access 2 things you store online. And much more,positive,0.375,,,,,1215053397067325440,subjective,0.525,,
ThirlwallAssoc,autonomous vehicles research,2020-01-08 20:17:11,"@Francois_Appere Did so much research for my book I've got thousands of referenced items to use as a resource! I also looked very briefly at how autonomous vehicles might impact city land use, so diverse topics.",positive,0.21666666666666667,,,,,1215004542175240193,objective,0.4444444444444444,,
UBTCIE,autonomous vehicles research,2020-01-08 16:26:22,#UBuffalo will receive nearly $800K to spark research in autonomous vehicles and clean energy: https://t.co/vdI751l1LX,positive,0.2888888888888889,,,,,1214946457918332930,subjective,0.6000000000000001,,
annmariehanlon,autonomous vehicles research,2020-01-08 09:55:01,Researchers are helping autonomous vehicles see around corners #research https://t.co/2Xbv8yxHLT https://t.co/xBoN7hrFkz,positive,0.4,,,,,1214847971793285121,subjective,0.7,,
kuenishi,autonomous vehicles research,2020-01-08 03:56:05,"GitHub - microsoft/AirSim: Open source simulator for autonomous vehicles built on Unreal Engine / Unity, from Microsoft AI &amp; Research https://t.co/GbmnBttmsu",positive,0.2,,,,,1214757640632332288,subjective,0.6,,
SmartETFs,autonomous vehicles research,2020-01-09 20:17:04,The road to safe #autonomous vehicles is paved with research and discovery. @penn_state is kicking off 2020 by looking into how to safely integrate AVs into work zones 🚧  https://t.co/pKJpqHipoI https://t.co/AXrLshOW9i,positive,0.4666666666666666,,,,,1215366900911394817,subjective,0.5666666666666667,,
tbeaudrymellor,autonomous vehicles research,2020-01-10 16:45:25,"And Saskatchewan is well on our way for most of them! From autonomous vehicles to the use of AI in CCS, to genomic research and its implications for precision ag &amp; health, to blockchain discussions we are pushing hard. https://t.co/Z81SN41glw",positive,0.24444444444444438,Seven biggest #tech trends in 2020. https://t.co/NhuWrO9rPa https://t.co/2A4GhLbKUj,neutral,0.0,,1215676025528471552,subjective,0.5805555555555556,very objective,0.0
maplesoft,autonomous vehicles research,2020-01-10 16:32:02,"Autonomous vehicles are on the way and industry-academia partnerships have an opportunity to play a leading role in their development, through academic research groups like @WatCARWaterloo. https://t.co/AODftnTmgz https://t.co/Yaf3dUiYLe",positive,0.2,,,,,1215672658198745089,objective,0.35,,
erinmcauliff,autonomous vehicles research,2020-01-11 17:46:27,"If you’re attending TRB this year, join me tomorrow for a workshop on Autonomous Vehicles and Paratransit at 1:30pm. There will be brief presentations (including yours truly) and then we will develop research questions to inform this area moving forward.",positive,0.2,,,,,1216053774864662530,subjective,0.5166666666666666,,
LythKross,autonomous vehicles research,2020-01-12 20:42:38,"Though I'll be unlikely to find anyone to help me or answer my questions, I'm going to start looking for people that have experience with autonomous vehicles and telematic controls soon. My original plan for a senior fell through but I still want to research it if possible :]",positive,0.155,,,,,1216460499497496576,very subjective,0.79,,
moneyscience,autonomous vehicles research,2020-01-13 06:59:04,Research: Dynamic Interaction between Shared Autonomous Vehicles and Public Transit: A Competitive Perspective. (arXiv:2001.03197v1 [physics.soc-ph]) https://t.co/WsyyzI6yRQ,positive,0.13333333333333333,,,,,1216615630478151681,objective,0.31111111111111106,,
brenlantz,autonomous vehicles research,2020-01-14 19:10:15,ATRI Senior Vice President Dan Murray presents the trucking industry perspective on connected and autonomous vehicles. @Truck_Research @NASEMTRB #TRBAM https://t.co/lC47iCGryT,positive,0.4,,,,,1217162028315480064,subjective,0.7,,
NCST_Research,autonomous vehicles research,2020-01-14 17:30:52,"In an attempt to model a future with personal #autonomous vehicles, researchers from @BerkeleyITS allowed subjects to have chauffeurs for a week. The results were staggering: participants increased their vehicle miles traveled by 83% over the week prior! https://t.co/aKwRepUg2r https://t.co/I2kcGGq3dX",positive,0.1,,,,,1217137014681763841,objective,0.28125,,
MetroLabNetwork,autonomous vehicles research,2020-01-14 17:12:39,"@cityofmemphis @uofmemphis @FedexInstitute preparing for adoption of #connected &amp; #autonomous vehicles, by engaging communities &amp; undertaking research to better understand usage &amp; adoption https://t.co/SirBCIIzkO",positive,0.43333333333333335,,,,,1217132430756384769,subjective,0.6333333333333333,,
jgustavob,autonomous vehicles research,2020-01-14 02:04:30,To coincide with the 99th Annual Meeting of Transportation Research Board @Ford Mobility and @CarTalkDC put on networking event about #EmergingTech on autonomous vehicles #selfdriving https://t.co/I3jwn3xf6u,positive,0.4,,,,,1216903887397015552,subjective,0.7,,
catire701939,autonomous vehicles research,2020-01-14 00:50:14,"@jamesvgingerich Recently, Embry-Riddle and Florida Polytechnic University entered into a research partnership (press release) where safety research initially developed for autonomous vehicles (AVs) will be applied to aerospace applications.",positive,0.16666666666666666,,,,,1216885196366274560,objective,0.4166666666666667,,
MITSeaGrant,autonomous vehicles research,2020-01-15 15:06:48,"What a great opportunity for pathfinding with our blue tech neighbors to the north yesterday! As AUV Lab Research Engineer Michael Sacarny noted, autonomous vehicles ultimately need to ""behave like prudent mariners"" and not rely solely on any single aid to navigation. Thanks all! https://t.co/Eq016t1kpQ",positive,0.2297619047619048,Thanks to @MITSeagrant and the team from the AUV lab for hosting our visiting group of #bluetech companies. https://t.co/oFqo22IWGX,positive,0.2,,1217463148325658626,objective,0.49404761904761907,very objective,0.2
UMichCCAT,autonomous vehicles research,2020-01-15 14:09:41,"CCAT Managing Director, Debby Bezzina, meeting with @CCATPurdue Graduate Research Student, Lisa Losada-Rojas to discuss her project with K. Nadia Gkritza and C.s. Gkartzonikas. The focus is on market acceptance of autonomous vehicles in disadvantaged areas. #TRBAM #CCATatTRB https://t.co/YAVqaNo0Yq",positive,0.4,,,,,1217448772831191042,subjective,0.7,,
Quanser,autonomous vehicles research,2020-01-16 15:20:06,"You received your QDrones, QBots and a lot of boxes with other components of your Autonomous Vehicles Research Studio - here are some setup tips to help you start your work faster: https://t.co/9eTsw5Nn5k",positive,0.1375,,,,,1217828881333411850,subjective,0.5375,,
NCCsecurityUS,autonomous vehicles research,2020-01-17 20:03:54,"Are you headed to @GMT_Research's ""Impact of Autonomous Vehicles on Public Transport"" event? Make sure to check out the presentation from our very own Jim McKenney, NCC Group Technical Director, discussing Data and Sharing Governance! https://t.co/oaaH5TuB73 https://t.co/sLL8HrsrTs",positive,0.336,,,,,1218262692898713608,subjective,0.5511111111111111,,
AkashSangshetti,autonomous vehicles research,2020-01-17 10:50:20,"https://t.co/DpCwo93tv2
Autonomous Vehicles Market Research Report- Global Forecast 2027
#AutonomousVehiclesMarket",positive,0.2,,,,,1218123380953452544,objective,0.35,,
VPiparsania,autonomous vehicles research,2020-01-18 12:54:28,"A summary of research for autonomous vehicles SoC solutions in 2020 by Counterpoint's Brady Wang
@CounterPointTR #AutonomousVehicles #autonomousCar 
@nvidia @Mobileye @Qualcomm 

https://t.co/euV4hnTFfe",positive,0.4,,,,,1218517010495094790,subjective,0.7,,
KristyDactyl,autonomous vehicles research,2020-01-19 19:44:35,Is anyone looking at how language being used for autonomous vehicles is dehumanizing pedestrians &amp; bicyclists? Are we training machines and future atv engineers to think of people as obstacles? @DrTaraGoddard 's research got me thinking @jessicaroberts @tooledesign @UCBSafeTREC https://t.co/eXkbvMuqSC,positive,0.11666666666666668,,,,,1218982605711904768,objective,0.27499999999999997,,
SciCommPSU,autonomous vehicles research,2020-01-20 16:37:03,"Interesting research story on autonomous vehicles #scicomm
https://t.co/LP8QdKDNZB",positive,0.45,,,,,1219297801127055360,subjective,0.6,,
UMengineering,autonomous vehicles research,2020-01-20 15:43:03,"Autonomous vehicles promise to be more energy efficient, move people and goods more easily, and could lead to more carpooling. But research from @UMIOE suggests we'll see the needle on these issues go the wrong way in early stages of AV adoption. https://t.co/Yh0Lj8fpLE https://t.co/ve37mshQof",positive,0.27619047619047615,,,,,1219284208264339462,subjective,0.6047619047619047,,
ASnowdenUoS,autonomous vehicles research,2020-01-20 15:30:21,"Big Monday meeting today, speaking to the Prime Minister’s Transport Advisor about a range of challenges and opportunities for public transport in the North, including the great work that @SalfordUni is doing on the the future of mobility with our Autonomous vehicles research. https://t.co/LUfDngTB0k",positive,0.24000000000000005,,,,,1219281014855557123,objective,0.34833333333333333,,
resolutemanager,autonomous vehicles research,2020-01-21 15:51:04,"Last week at Morgan Stanley’s West Coast Innovation Forum, @ARKInvest's Director of Research, Brett Winton @wintonARK, previewed #BigIdeas2020 covering Autonomous Vehicles and #DisruptiveInnovation. Read the report now: https://t.co/Y8eYa86J7Z. https://t.co/woKFojvN0q",positive,0.2,,,,,1219648613342728193,objective,0.3833333333333333,,
techwratch,autonomous vehicles research,2020-01-21 12:29:33,Research #states that #autonomous vehicles usually tend to #collide with #black folks https://t.co/q14c02Upsx #cars #people,neutral,-0.005555555555555545,,,,,1219597902747590663,objective,0.4611111111111111,,
Agenparl,autonomous vehicles research,2020-01-21 09:06:45,UM’s #Research #Project on #Autonomous vehicles listed under #Macao Funding Scheme for Key R&amp;D Projects - https://t.co/VUV7nuSDUT #Agenparl #Development #AgenparlEnglish #PoliticaEstera #SocialNetwork,positive,0.2,,,,,1219546865080918016,very subjective,0.85,,
MarkSouthwell6,autonomous vehicles research,2020-01-22 17:14:46,"With autonomous vehicles driving future mobility, it is vital we research and develop potential opportunities that enable @AECOM to be at the forefront of this innovative approach. 
Well done @CapriMobility for a fantastic start in Bristol yesterday.
https://t.co/q5t9qBxmtd",positive,0.2333333333333333,,,,,1220032067603443712,subjective,0.6875,,
KTPDurham,autonomous vehicles research,2020-01-22 09:49:17,Great opportunity for a KTP Research Associate in AI capabilities for Autonomous Vehicles with MODUS Seabed Intervention and Durham University. Apply online:  https://t.co/SshhOD1Tx0 Closes 19 Feb. #KTP #graduate #graduatejobs @durham_uni,positive,0.6000000000000001,,,,,1219919956395077632,subjective,0.725,,
UMIOE,autonomous vehicles research,2020-01-23 19:34:23,"“Pedestrians considered the traffic signal a higher authority, and expected the vehicles to stop no matter how aggressive the automated vehicle was driving.” — U-M IOE's Jessie Yang (@Jessie_YangXi) on recent research on pedestrian trust in autonomous vehicles. More in tweet⬇️ https://t.co/T1peVM6HhF",positive,0.21000000000000002,"We all understand the ""nod"" from a driver, signaling that they see us and it's okay to cross the street. But how do pedestrians know when it's safe to walk in front of an #autonomousvehicle? @umich researchers have some answers. https://t.co/gfJsd3aCyO https://t.co/wv8rUlboJ7",positive,0.3333333333333333,,1220429590641987586,objective,0.4699999999999999,objective,0.3333333333333333
Fintech2Day,autonomous vehicles research,2020-01-23 15:03:02,"In our latest #roundup, we pay tribute to @UMich who is leading #research into the #future of connected and autonomous #vehicles with the help of #insurance companies. https://t.co/Xn1zoo6NXr https://t.co/e91fELoxBk",positive,0.3,,,,,1220361303375609856,subjective,0.575,,
lsptechnologies,autonomous vehicles research,2020-01-23 14:01:13,"""Lasers are used in medical procedures, beauty treatments, telecommunications, industrial applications, robotics, autonomous vehicles, toys, scientific research and more. Due to their power and precision, lasers are also being developed for military use.""
https://t.co/jl56pVQ1cW",positive,0.12916666666666668,,,,,1220345748027596800,objective,0.32916666666666666,,
treabase,autonomous vehicles research,2020-01-23 12:25:25,$AAPL #patent 20200026288 GUIDANCE OF AUTONOMOUS VEHICLES IN DESTINATION VICINITIES USING INTENT SIGNALS #tech #IP #research https://t.co/G1z2B2Pvae,positive,0.4,,,,,1220321636458618880,subjective,0.7,,
UTBoydCenter,autonomous vehicles research,2020-01-24 20:59:46,"New Boyd Center research out this afternoon! Dr. Bill Fox and research associates Vickie Cunningham and Alex Norwood studied the potential impacts of autonomous vehicles on Tennessee's economy. 

Here's what they found:
https://t.co/mn6Aw8PDOq https://t.co/dmTObzNRC9",positive,0.1028409090909091,,,,,1220813466207830016,subjective,0.5636363636363637,,
efeatherston,autonomous vehicles research,2020-01-24 17:36:39,Interesting perspective and research - How can pedestrians trust autonomous vehicles https://t.co/Gb8aTXRhcA via @UMengineering #smartvehicles https://t.co/btmC7SbXlU,positive,0.45,,,,,1220762350992723968,subjective,0.6,,
Quanser,autonomous vehicles research,2020-01-24 17:20:12,"You received your QDrones, QBots and a lot of boxes with other components of your Autonomous Vehicles Research Studio - here are some setup tips to help you start your work faster: https://t.co/9eTsw5Nn5k",positive,0.1375,,,,,1220758211290128384,subjective,0.5375,,
RenataSMGomes,autonomous vehicles research,2020-01-24 13:19:50,Let’s all vote for the ⁦@aurrigotech⁩ &amp; ⁦@BlindVeterans⁩ research trial. Arthur was a driverless pod being put to the test by our fabulous blind veterans. Nominated for the autonomous vehicles silicon valley awards! Good luck 🌟🚘 VOTE!✅ https://t.co/4pymb9bfdR,positive,0.275,,,,,1220697719934767107,subjective,0.7416666666666666,,
SolutionizeG,autonomous vehicles research,2020-01-24 12:00:04,"#Uber begins mapping #Washington D.C. for #self-driving #vehicles! 
Uber’s #AdvancedTechnologiesGroup, responsible for #autonomous vehicles research — said that it will deploy a fleet of three cars in the nation’s capital starting on January 24.
https://t.co/w5Grofrmn1 https://t.co/17aIgYiA4n",positive,0.20000000000000004,,,,,1220677646129991680,objective,0.45,,
Khanoisseur,autonomous vehicles research,2020-01-25 15:08:55,"9. Toyota was an early investor in Tesla; in 2018 it announced a $500 million investment in Uber to co-develop autonomous vehicles. Toyota Research Institute, based in Silicon Valley, has been conducting tests in US at closed-course facilities for a number of years. https://t.co/qOrhdPnX1J",positive,0.25,,,,,1221087561336139778,objective,0.5,,
tunnelrat325,autonomous vehicles research,2020-01-26 23:08:53,@TrickyDickPol @TaceyJean18 @SUGARVAMPlRE @JamesAGagliano @AndrewYang It doesn't have to be fully autonomous to be devastating to the industry. Semi-autonomous vehicles could still reduce the number of truckers required. Latest research on AI is quite astounding and has already affected various jobs and industries and it's only going to accelerate.,positive,0.08333333333333333,,,,,1221570736508133376,very subjective,0.85,,
UMengineering,autonomous vehicles research,2020-01-26 15:56:02,"Autonomous vehicles promise to be more energy efficient, move people and goods more easily, and could lead to more carpooling. But research from @UMIOE suggests we'll see the needle on these issues go the wrong way in early stages of AV adoption. https://t.co/Yh0Lj8fpLE https://t.co/tIsi1ymToG",positive,0.27619047619047615,,,,,1221461802413850624,subjective,0.6047619047619047,,
seawanderernet,autonomous vehicles research,2020-01-26 13:45:58,"Scientists call for global array of autonomous vehicles

#research #buoys #autonomous #OceanSITES #Saildrone    @saildrone

https://t.co/HECQva2VDN https://t.co/iqtPT01W66",positive,0.26666666666666666,,,,,1221429070111617024,objective,0.4666666666666666,,
Quanser,autonomous vehicles research,2020-01-27 14:10:16,Great to see real-life applications of new ideas &amp; technology developed with tools like Quanser Autonomous Vehicles Research Studio and QDrone: https://t.co/sK8WNfMpDX,positive,0.3590909090909091,,,,,1221797575109545984,subjective,0.5511363636363636,,
DrSBirrell,autonomous vehicles research,2020-01-27 12:00:31,"Really exciting opportunity to join us at #CoventryUniversity leading research into #CAV. We are looking for a new #Professor of Connected and Autonomous Vehicles, with a focus on #MachineLearning, #ArtificialIntelligence and #SensorFusion. Apply here - https://t.co/mKnu42zqFA",positive,0.2787878787878788,,,,,1221764921450541056,subjective,0.6515151515151515,,
Quanser,autonomous vehicles research,2020-01-28 19:15:23,"Dr. Shan from York University @LassondeSchool of Engineering introduces his Spacecraft Dynamics, Control and Navigation Lab and the projects they are working on using the Quanser Autonomous Vehicles Research Studio with QDrones and QBots: https://t.co/qHDEWGsQih",positive,0.4,,,,,1222236746676670466,subjective,0.7,,
OSUEECS,autonomous vehicles research,2020-01-28 18:14:28,.@EngineeringOSU professor Houssam Abbas's research focuses on detecting the most damaging attacks to critical entry points in #autonomous vehicles and how to design onboard defenses. https://t.co/bhGs3MRPBD via @SPGMarketIntel https://t.co/EY4u0JcF0Q,positive,0.3,,,,,1222221417003044865,subjective,0.6666666666666666,,
MabiorDengKuer,autonomous vehicles research,2020-01-28 15:14:23,"Had a great day at Cranfield University in Milton keynes, UK. It was intriguing to learn about their research projects and processes in the fields of autonomous vehicles, battery and composites technologies.Multisectorial Sustainability engineering is the key to sustainable world https://t.co/GPNuZhqGY2",positive,0.375,,,,,1222176099221811200,subjective,0.7124999999999999,,
MDOT_UP,autonomous vehicles research,2020-01-28 13:23:27,@NiteNinja Agreed. Autonomous vehicles and sensors on snowy roads certainly need more research. The UP might have a role in testing new systems.,positive,0.31266233766233764,,,,,1222148183104589826,subjective,0.5564935064935065,,
WestofEnglandCA,autonomous vehicles research,2020-01-28 10:34:49,"Regional Mayor Tim Bowles joined @CapriMobility on Saturday for the Capri Project public trials @mallcribbs, to learn more about the cutting-edge research &amp; real-world testing of #LowCarbon #LowEmission #Connected &amp; #Autonomous #Vehicles taking place in the West of England.
#CAV https://t.co/VOG4DgR3sd",positive,0.3,,,,,1222105741533892610,objective,0.4222222222222222,,
istecnico,autonomous vehicles research,2020-01-29 14:53:01,"On the future of driving in the city, autonomous vehicles and car sharing, Técnico researchers @FilmouraMoura and Ana Martins from @u_shift CERIS research unit at @expresso newspaper https://t.co/gZWwU23Z4W https://t.co/jVYOqIbUbN",positive,0.2,"@FilmouraMoura and Ana Martins, researchers from @u_shift (@istecnico) about the future autonomous mobility and its challenges, at @expresso [@albuquerque_raq]. Check it out 👉
https://t.co/OckVA6o336",positive,0.2,,1222533108198715392,objective,0.4125,objective,0.4125
ejectamenta_com,autonomous vehicles research,2020-01-29 13:46:01,"@AvonandsomerRob @bruce_bwkm Autonomous vehicles that no one wants and no one will buy (except a few geeky fanatics), because most people with money to burn like to drive their expensive cars (that's why the cars they buy go faster than they need). Has anyone done any market research on them. I think not!",positive,0.05500000000000003,,,,,1222516247776067584,objective,0.41999999999999993,,
